Ether / IP / TCP 192.168.30.128:58966 > 142.250.194.66:https S
Ether / IP / TCP 142.250.194.66:https > 192.168.30.128:58966 SA / Padding
Ether / IP / TCP 192.168.30.128:58966 > 142.250.194.66:https A
Ether / IP / TCP 192.168.30.128:58966 > 142.250.194.66:https PA / Raw
Ether / IP / TCP 142.250.194.66:https > 192.168.30.128:58966 A / Padding
Ether / IP / TCP 142.250.194.66:https > 192.168.30.128:58966 PA / Raw
Ether / IP / TCP 192.168.30.128:58966 > 142.250.194.66:https A
Ether / IP / TCP 142.250.194.66:https > 192.168.30.128:58966 PA / Raw
Ether / IP / TCP 192.168.30.128:58966 > 142.250.194.66:https A
Ether / IP / TCP 192.168.30.128:42320 > 142.250.206.174:https PA / Raw
